{
  "schema_version": 1,
  "title": "Warhammer 40,000 edition timeline",
  "description": "Major game releases of Warhammer 40,000 from the first miniature range (Rogue Trader, 1987) to the current edition. Built as the spine of the Codex Armorum historical record. Each edition record is the parent milestone; per-model releases in model_catalogue_manual.json hang off these via release_year and the era ranges below.",
  "compiled": "2026-06",
  "notes": "Day-precise launch dates are given where Games Workshop announced them. Earlier editions use month or year precision only, matching what is reliably documented. Fields marked projected are not confirmed by Games Workshop.",
  "editions": [
    {
      "edition": 1,
      "name": "Rogue Trader",
      "full_title": "Warhammer 40,000: Rogue Trader",
      "era_start": "1987-09",
      "era_end": "1993-09",
      "announce_date": "",
      "release_date": "1987-09",
      "release_precision": "month",
      "lifespan_years": 6,
      "launch_box": "",
      "launch_box_note": "No starter set. Released as a single hardcover rulebook. Reprint still sold at Warhammer World.",
      "box_factions": [],
      "designers": ["Rick Priestly"],
      "rules_summary": "Foundational ruleset. A narrative, gamesmaster-led hybrid of skirmish wargame and roleplaying game with very detailed per-model profiles and open-ended wargear. Closer to a large skirmish than the platoon-scale battle game the line later became.",
      "key_changes": [
        "First Warhammer 40,000 rules and setting",
        "Gamesmaster-driven narrative play",
        "Deeply detailed wargear and character profiles"
      ],
      "iconic_models": [
        "RTB01 plastic Space Marines (Mk6 'beakie' helmets)",
        "Early Citadel metal Space Marine, Ork and Imperial Guard range"
      ],
      "narrative_hook": "Establishes the 41st Millennium and the grimdark setting.",
      "lineage_note": "Setting and mechanics trace partly to Laserburn (Tabletop Games, 1980, by Bryan Ansell).",
      "is_current": false,
      "sources": ["en.wikipedia.org/wiki/Warhammer_40,000", "wh40k.lexicanum.com/wiki/Warhammer_40,000", "chaosbunker.de Through the Ages"]
    },
    {
      "edition": 2,
      "name": "2nd Edition",
      "full_title": "Warhammer 40,000 2nd Edition",
      "era_start": "1993-10",
      "era_end": "1998-09",
      "announce_date": "",
      "release_date": "1993-10",
      "release_precision": "month",
      "lifespan_years": 5,
      "launch_box": "Warhammer 40,000 2nd Edition Boxed Set",
      "launch_box_note": "First time a single boxed set let a new player buy one product and play out of the box. RRP about 34.99 GBP / 59.99 USD.",
      "box_factions": ["Space Marines", "Orks"],
      "designers": ["Rick Priestly", "Andy Chambers"],
      "rules_summary": "Structured boxed game built on character-driven play, wargear and strategy cards, a card-based psychic phase and overwatch. Supported by the Dark Millennium expansion.",
      "key_changes": [
        "Dropped the Rogue Trader name",
        "Wargear, strategy and psychic cards",
        "Overwatch and detailed close combat",
        "Codex book line begins"
      ],
      "iconic_models": [
        "2nd edition plastic Space Marines",
        "Space Ork Goffs and Gretchin",
        "Squad reference card era miniatures"
      ],
      "narrative_hook": "Colourful, character-led era. White Dwarf issues 166 to 225.",
      "is_current": false,
      "sources": ["wh40k.lexicanum.com Warhammer 40,000 2nd Edition Box Set", "chaosbunker.de 2nd Edition Starter Set unboxing"]
    },
    {
      "edition": 3,
      "name": "3rd Edition",
      "full_title": "Warhammer 40,000 3rd Edition",
      "era_start": "1998-10",
      "era_end": "2004-09",
      "announce_date": "",
      "release_date": "1998-10",
      "release_precision": "month",
      "lifespan_years": 6,
      "launch_box": "Warhammer 40,000 3rd Edition Box Set",
      "launch_box_note": "Softback rulebook plus two forces. Marked the debut of the Dark Eldar as the antagonist faction.",
      "box_factions": ["Space Marines", "Dark Eldar"],
      "designers": ["Andy Chambers", "Rick Priestly", "Gav Thorpe"],
      "rules_summary": "The most significant overhaul to that point. Replaced the dense 2nd edition charts with a core rules plus exceptions model that all later editions built on. Introduced the Force Organisation Chart and simplified vehicle and psychic rules.",
      "key_changes": [
        "Force Organisation Chart introduced",
        "Core rules plus exceptions design",
        "Vehicle and psychic rules simplified",
        "New game logo used from 3rd to 8th edition"
      ],
      "iconic_models": [
        "Dark Eldar Kabalite Warriors (faction debut)",
        "Tau and Necrons introduced late in the edition"
      ],
      "narrative_hook": "Streamlined for larger, faster battles. Tau debut coincided with a popularity surge in the United States.",
      "is_current": false,
      "sources": ["wh40k.lexicanum.com 3rd Edition Box Set", "boardgamegeek.com Third Edition Starter Set", "grimdarkgamer.com box sets overview"]
    },
    {
      "edition": 4,
      "name": "4th Edition",
      "full_title": "Warhammer 40,000 4th Edition",
      "era_start": "2004-09",
      "era_end": "2008-06",
      "announce_date": "",
      "release_date": "2004-09",
      "release_precision": "month",
      "lifespan_years": 4,
      "launch_box": "Battle for Macragge",
      "launch_box_note": "A beginner focused game in a box with a compact softcover ruleset. Expansion The Battle Rages On added scenarios and units.",
      "box_factions": ["Space Marines", "Tyranids"],
      "designers": ["Andy Chambers"],
      "rules_summary": "A measured revision rather than a rewrite. Backwards compatible with 3rd edition codices, with refined terrain, cover and background content. Released as hardback rulebook, the Battle for Macragge boxed set, and a Collector's Edition.",
      "key_changes": [
        "Backwards compatible with 3rd edition codices",
        "Refined terrain and cover",
        "Beginner friendly boxed entry point"
      ],
      "iconic_models": [
        "Tyranid swarm from Battle for Macragge",
        "Ultramarines tactical squad"
      ],
      "narrative_hook": "Set during the Tyranid invasion of Macragge, the First Tyrannic War.",
      "is_current": false,
      "sources": ["wh40k.lexicanum.com Warhammer 40,000", "warhammer40k.fandom.com Codex", "grimdarkgamer.com box sets overview"]
    },
    {
      "edition": 5,
      "name": "5th Edition",
      "full_title": "Warhammer 40,000 5th Edition",
      "era_start": "2008-07",
      "era_end": "2012-05",
      "announce_date": "",
      "release_date": "2008-07",
      "release_precision": "month",
      "lifespan_years": 4,
      "launch_box": "Assault on Black Reach",
      "launch_box_note": "First starter set to include proper armies rather than a squad or two per side. Each side had an HQ, troops and more, with the Ork Warboss, Nobz and Deffkoptas long exclusive to this box.",
      "box_factions": ["Space Marines", "Orks"],
      "designers": ["Alessio Cavatore"],
      "rules_summary": "Shared the 4th edition core but added major changes. True Line of Sight made terrain placement critical, the Run rule gave infantry flexibility, and transports became central to the competitive meta.",
      "key_changes": [
        "True Line of Sight",
        "Run rule added",
        "Mechanised transport heavy meta (Rhino Rush, Razorback spam)",
        "Reworked wound allocation"
      ],
      "iconic_models": [
        "Assault on Black Reach Ork Warboss and Deffkoptas",
        "Captain Sicarius"
      ],
      "narrative_hook": "Competitive 40k matured significantly during this era.",
      "is_current": false,
      "sources": ["warhammerguild.com 40k edition history", "warhammer40k.fandom.com Codex", "chaosbunker.de Through the Ages"]
    },
    {
      "edition": 6,
      "name": "6th Edition",
      "full_title": "Warhammer 40,000 6th Edition",
      "era_start": "2012-06",
      "era_end": "2014-05",
      "announce_date": "",
      "release_date": "2012-06",
      "release_precision": "month",
      "lifespan_years": 2,
      "launch_box": "Dark Vengeance",
      "launch_box_note": "Replaced Assault on Black Reach. Early copies included a limited edition Interrogator-Chaplain for the Dark Angels.",
      "box_factions": ["Dark Angels", "Chaos Space Marines"],
      "designers": [],
      "rules_summary": "Expanded army building with the Allies system and Fortifications, and added Warlord Traits, expanded psychic powers, Flyers and Overwatch with greater scenery interaction.",
      "key_changes": [
        "Allies system",
        "Fortifications",
        "Warlord Traits",
        "Flyers and Overwatch"
      ],
      "iconic_models": [
        "Dark Vengeance Dark Angels (Ravenwing and Deathwing elements)",
        "Chaos Hellbrute and Chosen"
      ],
      "narrative_hook": "Crimson Slaughter Chaos warband versus the Dark Angels.",
      "is_current": false,
      "sources": ["warhammer40k.fandom.com Warhammer 40,000", "en.wikipedia.org Warhammer 40,000"]
    },
    {
      "edition": 7,
      "name": "7th Edition",
      "full_title": "Warhammer 40,000 7th Edition",
      "era_start": "2014-05",
      "era_end": "2017-06",
      "announce_date": "",
      "release_date": "2014-05",
      "release_precision": "month",
      "lifespan_years": 3,
      "launch_box": "Dark Vengeance (carried over); later Stormclaw and other battleboxes; Battle for Vedros entry set",
      "launch_box_note": "Reused the Dark Vengeance starter with updated rules. Themed battleforce boxes set you up with specific armies, and Battle for Vedros reused the 5th edition Assault on Black Reach sprues as a low cost entry point.",
      "box_factions": ["Dark Angels", "Chaos Space Marines"],
      "designers": [],